标题,链接,封面,内容,推出日期
早知天下事,https://mp.weixin.qq.com/s/g1HT4PSsgAyI6uZZVuSOPA,https://mmbiz.qpic.cn/mmbiz_jpg/azXQmS1HA7m2BSVibribXbgpQUgOxibL81l2uib2n5plJgD12AoqJj0DsHr76AzQ7MgKx9wJB2UPLrjDmKxaAoNuwA/0?wx_fmt=jpeg,习近平在广东考察时强调，深入学习宣传贯彻党的二十届四中全会精神，以全面深化改革开放推动高质量发展。中华人民共和国第十五届运动会开幕式9日晚在广东广州举行，习近平将出席开幕式并宣布运动会开幕。国务院新闻办公室发布《碳达峰碳中和的中国行动》白皮书。商务部新闻发言人就安世半导体问题答记者问。详情>>海军新闻发言人就福建舰入列有关问题答记者问。详情>>《中国互联网发展报告2025》和《世界互联网发展报告2025》蓝皮书在2025年世界互联网大会乌镇峰会上发布。《中国互联网发展报告2025》认为，人工智能在我国将实现从点状应用到全域赋能的转变，并成为实体经济智能化升级的核心驱动力。北京时间8日13时03分，正在执行中国第42次南极考察任务的“雪龙”号穿越赤道进入南半球。预计“雪龙2”号也将于9日驶过赤道。中俄蒙签署“万里茶道”旅游合作发展计划。美国最高法院7日晚批准特朗普政府的紧急上诉，暂时阻止下级法院要求联邦政府最迟在当天必须全额支付11月份“补充营养援助计划”救济金的命令。法国总统马克龙访问墨西哥。在被问及美国近期频频在拉美国家附近海域击沉所谓“贩毒船”时，马克龙表示，打击贩毒必须尊重各国主权。巴西联邦最高法院宣布驳回前总统博索纳罗辩护团队的上诉，维持对博索纳罗及另外6名被告在策划政变案中的刑事定罪。日本厚生劳动省发布的数据显示，截至11月2日的一周内，日本全国数千家定点医疗机构共报告流感病例逾5.7万例，新确诊病例数较前一周翻番。韩国前总统尹锡悦和妻子金建希同日同法院受审，系韩国宪政史首次。世界首台650摄氏度高效超超临界燃煤发电机组在华能玉环电厂开工建设。由中国科学家牵头的国际团队通过古DNA测序技术发现，秦始皇祖母夏太后陵墓中出土的长臂猿是一个新物种，属于冠长臂猿属。该成果发表在了国际期刊《细胞》（Cell）上。北京地铁8号线大红门站正式开通，实现与北京地铁10号线的双向换乘。至此，北京地铁8号线这条贯穿京城南北向的“地下中轴线”全线贯通。山东队刘志城在十五运会公路自行车男子个人赛中率先撞线。第十五届全运会9日晚开幕。在十五运会主新闻中心，记者看到了全运会限定樊振东、苏炳添咖啡拉花，全程机器人制作，从取杯到出餐，整个过程不到1分钟。网友：全运健儿限定咖啡拉花爱了爱了！近日，辽宁，大连外国语大学的保洁阿姨将银杏落叶布置成各种可爱的形状。星星、月亮、笑脸、爱心……随着落叶越来越多，阿姨们又做了银杏伞、银杏椅。网友：来自保洁阿姨的顶级浪漫。11月8日20时至9日20时，内蒙古东部、东北地区东部和北部、西藏东北部、西北地区中部、川西高原北部等地部分地区有小雪或雨夹雪，其中，内蒙古东北部、黑龙江北部、青海南部、甘肃南部等地部分地区有中雪，局地大雪。江汉南部、江南北部、重庆中部、西南地区南部等地部分地区有中到大雨，其中，云南西南部等地局地有暴雨。11月10日晚，木星和双子座中最亮的恒星北河三将会与一轮亏凸月联袂上演一出“双星伴月”的好戏，三者届时还会在天空中组成一张“笑脸”的样子。把属于大自然的浪漫戴头上！用落叶做出趣味“魔法帽”，大人孩子一起动手更开心！清洗会加速鸡蛋变质？这个“干净”习惯要改掉！【新的一天，加油！】路遥知马力，日久见人心。时间是最好的过滤器，时间沉淀下的真诚与担当，方是友情的最好试金石。点赞祝早安！,2025-11-09 06:00:00
94岁战地记者，收到了一份特殊礼物......,https://mp.weixin.qq.com/s/yVbzA_47tS7EiJyPeC4U8g,https://mmbiz.qpic.cn/mmbiz_jpg/azXQmS1HA7m2BSVibribXbgpQUgOxibL81lAvuIWdORFoic7C5wXgzI8AD5bxg98ZQl67JicrVWm0FYO3IQmRV6YRLQ/0?wx_fmt=jpeg,今天是中国记者节94岁的抗美援朝老兵胡明收到了来自退役军人事务部宣传中心的一份特殊礼物一台崭新的拍立得相机“咔嚓”一声，快门轻响一张新的戎装照几秒就定格出片胡明接过相片看了又看七十多年前那3000多张老照片似乎又浮现在眼前战地快门：以镜头为枪，为战友留名“战友拿枪冲锋，我拿相机冲锋” 这句话，胡明念叨了一辈子1952年，22岁的胡明是原中国人民志愿军独立33师唯一的摄影干事他手中的武器是淮海战役缴获的日本老式皮腔相机师首长的嘱托如烙印般刻在他心上“给每个兵留张照，别让他们成无名英雄”在朝鲜零下30度的天气里胡明钻坑道、跑阵地，在炮火中抢拍每一个珍贵瞬间两个月里，胡明日夜奔忙在火炕搭建的临时暗房里用碗筷充当工具，冲洗照片长期浸泡在化学药水中他的手关节严重变形硬是为3000多名战友留下了戎装照相片背面工整地写着姓名、籍贯有的还带着“母亲，我一切安好”的牵挂这个18岁参加中国人民解放军22岁随部队开拔朝鲜战场的年轻战士用自己的勇敢与无畏记录下中国人民志愿军英勇杀敌、不怕牺牲的光辉形象照片密码：70年等待，让无名英雄归乡战火纷飞中，许多照片还没来得及送到战友手中就随着烈士的遗体留在了异国他乡但胡明拍摄的每一张照片都成了跨越时空的“身份密码”更串联起一场场跨越山海的双向奔赴几十年来，胡明始终牵挂着当年并肩作战的老战友未曾再相见的思念让他格外渴望能再与老战友们重逢为了圆老人这份沉甸甸的心愿退役军人事务部宣传中心新华社新媒体中心山东广播电视台三台联合在2025年山东春晚推出了“老战友你在哪儿”新媒体征集特别策划在退役军人系统、媒体、战友与近千名网友的帮助下数以千计的线索源源不断汇聚而来节目组循着线索先后走进20多个城市联系了近百位志愿军老战士最终成功为胡明找到了10余位老战友或其家属春晚播出后越来越多的线索浮现出来“老战友你在哪儿”的寻找还在继续为了让更多的英雄故事继续流传节目组的寻访仍在路上这一年，我们以胡明拍摄的照片为线索足迹走遍全国26个城市行程达9000多公里成功找到了36位原中国人民志愿军独立33师老战士10月25日由退役军人事务部宣传中心联合山东广播电视台出品的纪录片《戎装照》播出纪录片以“照片”为眼、以“情感”为魂通过4K超高清技术生动还原一张张泛黄照片背后的热血与柔情让伟大的抗美援朝精神在新时代焕发新的光芒“我的任务没有完成啊！” 七十年过去，胡明仍为没能给全师官兵都拍下照片惋惜摩挲着手中的拍立得“当时要是有这个就好了” 简单的话语里是对战友深深的记挂与遗憾快门传承：年轻记者接棒奔跑当94岁的胡明再次举起相机习惯性地半闭眼睛对准年轻面孔变形的关节诉说着往昔的艰辛一群年轻记者正循着他的足迹用新时代的笔墨与镜头续写“为时代留影、为英雄立传”的初心胡明在新拍的戎装照背面郑重写下“希望年轻一代进一步弘扬抗美援朝精神” 从火炕暗房、碗筷冲洗的艰苦岁月到瞬间定格、即时成像的数字时代变化的是摄影设备不变的是对英雄的敬畏与缅怀越来越多的年轻记者接过精神火炬行走在当年的战地遗迹上用镜头和代码搭建起连接过去与现在的桥梁让英雄故事在数字时代焕发新的光芒在这个属于记者的节日里看着胡明老人握着新相机的模样更加感受到“记者”二字的厚重70年前，他以镜头为枪在朝鲜战场的炮火中抢拍战友的青春面庞70年后，年轻记者们带着他的初心出发用直播、AI、VR技术让英雄故事穿越时空让无名烈士归乡之路不再漫长记者，从来都不只是 “记录者”他们是战火中逆行的勇士是和平年代里守护记忆的匠人是连接过去与现在的桥梁这些被记录下来的瞬间无论是炮火中的背影、寻亲时的泪水还是平凡生活里的感动最终都会汇聚成一个民族的集体记忆成为永不褪色的精神财富今天，让我们向所有记者致敬：致敬你们翻山越岭的脚步致敬你们穿透迷雾的目光致敬你们笔下有温度镜头有力量愿我们永远记得每一次快门按下每一个文字落笔都是在为时代存档为正义发声、为精神续航快门为证，初心相传祝所有记者节日快乐愿我们永远与真相同行与光明相伴！来源：中国退役军人微信公众号（ID：zgtyjr）素材来源：中国退役军人综合新华社、山东卫视、齐鲁网、齐鲁前哨作者：中国退役军人 全媒体实习记者 孙韩琦点赞！,2025-11-08 22:41:47
夜读｜可以随时打扰的人，遇到了请珍惜,https://mp.weixin.qq.com/s/mynG3UYLxuMJ8yomUxXCGA,https://mmbiz.qpic.cn/mmbiz_jpg/azXQmS1HA7m2BSVibribXbgpQUgOxibL81lPqe3WHmYqxTWnAVuYia1TZf4OCUTszRCcw0woXP9x9POwQSwCzlAKtQ/0?wx_fmt=jpeg,可以随时打扰的人，遇到了请好好珍惜01微信好友列表再长也抵不过一个知心人你是否也有过这样的经历：遇到烦心事，心情低落想找个人说说，手指在长长的微信好友列表上滑动，最终还是停在了那个熟悉的名字上。一段关系能给予你安全感的最好证明，就是那个人能随时让你打扰。在那个人面前，我们可以放心做真实的自己。无论是狼狈的瞬间，还是搞砸的糗事，对方都不会介意。那些对旁人说不出口的心里话，在那个人面前可以畅所欲言。也许对方无法对每件事都给出完美的回应，但始终愿意倾听、理解，并坚定地站在你身边。可以随时打扰的人，不需要很多，一个就够了。02有真正的好朋友是人生一件幸事读一本触动人心的好书，转头能和Ta说“这书真好”；看到一处治愈的风景，随手拍给Ta分享“这里好美”。遇到开心的事，有人与你同喜，快乐便放大了几分；碰到一件伤心事，有人听你倾诉，难过便减轻了许多。真正的好朋友，不一定是那个跟你聊天最多、给你的朋友圈点赞最多的人，但一定是在你需要的时候，第一个挺身而出的人。有这样的朋友，本就是人生中一件难得的幸事。03可以随时打扰的人遇到了请好好珍惜伴随着年龄增长，愈发明白，三两知心好友，胜过万千点头之交。朋友之乐，贵在那份踏实和信赖。人生得一知己不易，一定要好好珍惜那些真正对你好的人。那些在大雨中为你撑伞的人，陪你彻夜聊天的人，陪你放声大哭的人，不远千里坐车来看望你的人，总以你为重的人......正是他们，组成我们生命中一点一滴的温暖。如果你身边也有这样的朋友，一定要多主动联系，多花些时间和心思，走进Ta的内心和生活。你能够随时打扰的人，一定很懂你，愿意被你随时打扰的人，真的很在乎你，遇到这样的人，一定要好好珍惜。余生漫漫，来日方长愿我们都能和那个能随时打扰的好友彼此温暖，一路相伴亲爱的你晚安右下角点个赞再走来源：人民日报夜读，综合夜听等主播：陈嘉点赞，祝您晚安！,2025-11-08 21:46:14
14岁初中生作文，让无数人泪目,https://mp.weixin.qq.com/s/43Y2E6wGywtVOHjUBb2JCg,https://mmbiz.qpic.cn/mmbiz_jpg/azXQmS1HA7m2BSVibribXbgpQUgOxibL81lfJk9SM7YBIkzo8oafJhBxeSlZ2yWrLE6I8sEKNUuw4y7kp7yAeYRRA/0?wx_fmt=jpeg,“只是一层薄薄的土，人与人就再难相见了”近日，湖南娄底初三学生龙睿熙的作文《藏在罐子里的爱》，让无数人泪目。《藏在罐子里的爱》龙睿熙秋夜寒凉，月光朗照，夜空中倔强地闪着几点星光。我抬起头凝视着天上闪亮的星，想起我妈曾经在星空下和我说过：每个勤劳善良的人在死后都会变成天上的星星，守护着地上的人。幼小的我便在想：哪一颗会是奶奶呢?星辰点点，月光流转，跨过了时间，照在了橱柜的罐子上。那时的我还只有几岁大，和爷爷奶奶一起生活在乡下。当时的我话都说不太利索，天天只知道往外跑，对外界的一切都有着极大的好奇心，总是喜欢跟着大声嘎嘎的肥鸭绕着院子转。屋里的各种小东西都喜欢看一看，摸一摸，有时甚至还会用嘴尝一尝。那是一个炎热的下午，毒辣的太阳炙烤着大地，刺眼的阳光令人望而生畏。我像一只无头苍蝇一样在院子里乱窜，一转头，又跑进了厨房，看到了正在忙活着的奶奶。极度无聊的我看见旁边的橱柜上有一个罐子，我努力踮起脚，伸手想去拿，可不管怎么努力就是差那么一点。奶奶好似背后也长了一双眼睛，看到了我头顶的罐子，也看到了我嘴角的口水。她水龙头都没关，扔下手上的东西就走了过来，在围裙上小心翼翼地擦干双手就把我抱到了旁边。这才转过身去拿罐子，拿着小勺子轻轻舀了一勺放到了我的嘴里，入口时这种甜蜜的味道不断地冲击着我的大脑，于是我记住了这种白色小颗粒带来的快乐。后来奶奶每天都会给我吃一点，每次我都笑得非常开心，奶奶明明没有吃，却也和我一样开心。幸福从罐子里跑了出来，弥漫了整个屋子。后来，我离开了老家，来到城里读书。也是在厨房里，我看见了一个差不多的罐子，里面也装满了白色的小颗粒。我欣喜地拿了一点尝了尝，好像尝到一样的甜就能回到和奶奶在一起的好时光。可是传到嘴里的却是一股苦味，这时我才明白什么是糖，什么又是盐。可是这时我已经无法向她撒娇要糖吃了。“物是人非事事休，欲语泪先流。”今天乡下的月很圆，后山的土地和院子里的人沐浴着同样的月光。只是一层薄薄的土，人与人就再难相见了。这篇作文，来自湖南娄底市第一中学附属星星中学的初三语文老师童丽芳布置的半命题作文“藏在___的爱”。童丽芳在批改作文时，被14岁学生龙睿熙回忆已离世十年奶奶的句子打动。在征得同意后，她将这篇作文分享到了网络平台。《藏在罐子里的爱》最初版本文字童丽芳说，在发布前她曾与龙睿熙反复确认，甚至将文字放到网上查重。“我还给他的爸爸妈妈发了消息，当时提了一嘴孩子奶奶，爸爸妈妈就马上提到了糖罐子这件事。细节也能核对上，而且，这不是他第一次写自己的奶奶。他有这样的文字表达能力。”作文背后：奶奶去世时他才4岁父母时常跟他说“奶奶是个很好的人”在谈到文章创作灵感时，龙睿熙在回忆奶奶时红了眼眶。“我和爸妈弟弟交流很多，他们的爱不算藏起来的。所以想到了奶奶。”许多人被文章打动，以为龙睿熙与奶奶有漫长深厚的相处时光，但他坦言，虽然奶奶从小陪伴着自己长大，但在十年前去世，那时他只有4岁，记忆也在此停止。龙睿熙家庭合照，图源/当事人家属龙睿熙不会说娄底话，奶奶只会说方言，交流几乎无法进行。“我们几乎没话说。”但这份沉默的爱被岁月风干成甜，在记忆里反而愈发清晰的是奶奶的背影。可有些东西留下了——那糖罐子下藏着的那点甜。由于父亲不愿多提逝去的母亲，奶奶的形象更多是经由妈妈的日常讲述而留存下来。妈妈总会念叨“奶奶是一个很好的人”，这些点滴的家庭记忆，让奶奶的形象在龙睿熙心中不断被重温，最终被他用文字“留住”了。 回应AI写作质疑：“我觉得这算另一种夸奖” 14岁的龙睿熙在担心，担心被捧得太高，担心下次写不出这样的文字。龙睿熙初中时参加象棋比赛“有网友说靠情感打动人初中还行，高考作文不会出色，还有人怀疑是AI写的。”龙睿熙笑了笑，“我觉得这算另一种夸奖，他们没否定文章本身，只是怀疑是不是我写的。但文章表达了我的感情，这就够了。” 对于未来，龙睿熙坦言目前只想继续平淡的生活和学业。临近初三升学考试，对于是否把写作当成专业，他尚未多想。这篇作文很快引发了网友们的集体共鸣无数人在评论区倾诉着自己对奶奶的思念有网友说：“奶奶带大的孩子才懂”“我也想我奶奶了小时候没有什么饮料奶奶总是给我冲红糖水喝还会用手绢小心翼翼包着攒下的钱给自己买喜欢的东西每次离家时奶奶总会驼着背在屋前挥手哪怕走了很远回头望去那个身影依然在原地”龙睿熙罐子里的白糖网友记忆中口袋里的零食、手绢里的零钱、屋前的身影……都是奶奶们藏在细节里的爱这些朴素又纯粹的温暖藏在岁月的褶皱里被文字唤醒也让那些深埋心底的思念都有了温柔的寄托很多人的记忆里都有这样一个“罐子”里面装着爷爷奶奶给过的简单却也再也买不到的甜罐子会空，人会走远但那弥漫一生的爱成了我们心中永远的牵挂来源：新华每日电讯微信公众号综合潇湘晨报、央视新闻、重庆共青团、江苏新闻点赞！,2025-11-08 20:53:25
古DNA测序发现：秦始皇祖母陵墓出土的长臂猿为灭绝新物种,https://mp.weixin.qq.com/s/2BnAzyDrqmJIT8BV67APUg,https://mmbiz.qpic.cn/mmbiz_jpg/azXQmS1HA7m2BSVibribXbgpQUgOxibL81l0nZewT844FPIyLC8SnepI1GTa7QcuH6XECDQXsvwon6vtkXk1CR7oA/0?wx_fmt=jpeg,秦始皇祖母陵墓出土的长臂猿为灭绝新物种由中国科学家牵头的国际团队通过古DNA测序技术发现，秦始皇祖母夏太后陵墓中出土的长臂猿是一个新物种，属于冠长臂猿属。该成果于北京时间11月8日凌晨发表在了国际期刊《细胞》（Cell）上。2004年，陕西省考古研究院在发掘秦始皇祖母夏太后陵园时，在第12号陪葬坑中发现包含长臂猿骸骨的动物骨骼群。2018年，中英科学家通过形态学研究认为其为长臂猿一新属、新种，已经灭绝，并将其命名为“帝国君子长臂猿”。帝国君子长臂猿头骨。（陕西省考古研究院供图）2025年，中国科学院古脊椎动物与古人类研究所研究员付巧妹团队通过提取该长臂猿牙齿上的古DNA进行测序，发现帝国君子长臂猿并不是一个新属，而是一个新种。“我们更正了此前的研究结果，确认帝国君子长臂猿是冠长臂猿属的一个新物种，它与今天的海南长臂猿很像，是近亲。”论文通讯作者、中国科学院昆明动物研究所研究员吴东东说。帝国君子长臂猿与今天的海南长臂猿是近亲，图为海南长臂猿。（赵超 摄）据介绍，帝国君子长臂猿出土位置位于陕西西安南郊秦始皇祖母夏太后陵墓东南侧的第12号陪葬坑，同坑出土动物还有豹猫、猞猁、亚洲黑熊、丹顶鹤等，同时还出土有青铜铁链及饲养器具。“据此可以推断出，2000多年前，夏太后在世时喜欢养珍禽异兽，这些宠物被豢养在皇家苑囿中，夏太后死后，这些动物可能就随她殉葬了。这一行为体现了古人事死如事生的丧葬观念。”论文作者之一、山东大学教授、陕西省考古研究院研究员胡松梅说。此外，本次研究还有一些有趣的发现，比如，科学家从基因组角度进一步夯实了“天行长臂猿”作为一个独立物种的分类学地位；发现了调控长臂猿“胳膊长”的基因“SHH”等。本次成果由中国科学院昆明动物研究所牵头，中国科学院古脊椎动物与古人类研究所、中山大学、陕西省考古研究院、山东大学、苏格兰博物馆等机构共同完成。来源：新华社记者：岳冉冉期待更多新发现！,2025-11-08 19:18:41
中华人民共和国第十五届运动会开幕式9日晚在广东广州举行　习近平将出席开幕式并宣布运动会开幕,https://mp.weixin.qq.com/s/QOqCM2ZdprMmDsD1H2Geag,https://mmbiz.qpic.cn/mmbiz_jpg/azXQmS1HA7mQvjibkphticwxmeakUKO2ZBg2QfbwWKs1bydhqibS6Via0omJ5tS27xlSDHORVYZnOicONyqqnxPQO3g/0?wx_fmt=jpeg,中华人民共和国第十五届运动会开幕式11月9日晚在广东奥林匹克体育中心举行。中共中央总书记、国家主席、中央军委主席习近平将出席开幕式并宣布运动会开幕。届时，中央广播电视总台将进行现场直播，新华网进行图文直播。（新华社广州11月8日电）来源：新华社点赞！,2025-11-08 18:04:32
重大发现！我国探获一处超大型矿床,https://mp.weixin.qq.com/s/S1AcMemGbGxkcS2jAF_OVA,https://mmbiz.qpic.cn/mmbiz_jpg/azXQmS1HA7k51qib2brfCj5lZDtVWo9oX3hCxl73u3dx5aNApS6YkY4XGXG7Z6c2HN5AzsleBicCnQnSeoTtRdHw/0?wx_fmt=jpeg,甘肃探获超7亿吨大型冶镁白云岩矿记者11月6日从甘肃省自然资源厅获悉，甘肃省平凉市崆峒区近日成功探获一处超大型冶镁白云岩矿床，资源量超过7亿吨。这一重大发现标志着甘肃省在矿产资源勘查领域取得重要突破。据介绍，该矿床位于崆峒区转马台一带。勘查结果显示，矿体赋存于中元古界蓟县系王全口组浅海相碳酸盐岩地层中，共圈定出5个呈层状分布的冶镁白云岩矿体。矿石中氧化镁平均品位达20.67%，为优质的冶镁白云岩矿，且矿体规模大、埋藏浅、倾角平缓、厚度稳定，便于露天开采。经估算，露天开采范围内，累计查明冶镁用白云岩矿石量超7亿吨，还探明3亿余吨建筑用白云岩。据了解，白云岩矿资源利用价值多元，除作为金属镁冶炼重要原料外，还可应用于耐火材料、冶金熔剂、玻璃和陶瓷等工业领域，资源综合利用潜力巨大。来源：新华社记者：张新新点赞！,2025-11-08 17:23:36
海军新闻发言人就福建舰入列有关问题答记者问,https://mp.weixin.qq.com/s/aoF6TxVuc0PzcfexVvl-Eg,https://mmbiz.qpic.cn/mmbiz_jpg/azXQmS1HA7m2BSVibribXbgpQUgOxibL81lYibINbfOTOKsNGtQcyayMJycWOTc6x8YpD36Qp1SP5RA5LAJ1gKFgDQ/0?wx_fmt=jpeg,11月5日，我国第一艘电磁弹射型航空母舰福建舰在海南三亚某军港入列。8日下午，海军新闻发言人冷国伟海军大校就福建舰部署地点、舰载机配备和中国海军航母发展计划等问题，接受记者书面采访。在回答福建舰是否会在三亚军港部署时，冷国伟表示，福建舰是海军现役吨位最大的舰艇，综合考虑战备需要、港口条件、保障能力、任务特点等因素，该舰常驻地为三亚军港。海军舰艇官兵常年岸上做客、海上为家。波澜壮阔的远海大洋，才是航母真正的家。未来，福建舰将常态出现在那片广阔的舞台。关于福建舰舰载机何时满编上舰，冷国伟说，舰载机是航母战斗力的核心，福建舰建造的同时，歼-35、歼-15T、歼-15D等舰载战斗机、空警-600舰载固定翼预警机、直-20系列舰载直升机等配套装备研制试验工作也在按计划稳步推进，至于何时能够实现满编上舰，他和大家一样期待，相信不会等太久。关于福建舰入列后是否还要继续开展试验试航，何时能够形成实战能力，冷国伟表示，福建舰是我国第一艘电磁弹射型航母，是海军转型建设跨越式发展的标志性装备，很多设备和技术都是第一次实际运用，入列后该舰将继续深入开展相关试验验证，进一步检验平台系统稳定性，同时将按计划安排舰机适配、编队体系训练等，不断强化实战能力。在回答关于中国海军下一步航母发展计划时，冷国伟表示，中国发展和改进武器装备，不针对任何国家和特定目标，不会对任何国家和地区构成威胁，完全是为了维护国家主权、安全、发展利益。对于中国航母的后续发展计划，将根据国防需要综合考虑。需要强调的是，中国的社会主义国家性质、走和平发展道路的战略抉择、独立自主的和平外交政策，决定了中国奉行防御性国防政策始终不变。有记者问，航母命名一直是外界比较关注的话题，很多网友都在网上发声为自己的省份争取航母命名权，能否透露哪些省份被纳入了“航母命名库”？冷国伟告诉记者，根据中国人民解放军海军舰艇命名相关规定，航空母舰以省级行政区划命名，在命名过程中还会综合考虑各省、区、市申请意愿等因素，最终报中央军委批准后确定。至于“航母命名库”，并不存在这样一个名单，后续如果有相关的最新消息，将会第一时间和大家分享。来源：新华社作者：黎云、孙飞关注！,2025-11-08 16:19:40
