标题,链接,封面,内容,推出日期
夜读｜感恩朋友圈这3种人,https://mp.weixin.qq.com/s/ZoJHplG1EBOPnv2UtTV4nQ,https://mmbiz.qpic.cn/mmbiz_jpg/azXQmS1HA7k51qib2brfCj5lZDtVWo9oXl36ib5kba5a1TzK0dCreVuU0xNF0ibDIO1UwguibiaqjtnNjydo4DIMiamg/0?wx_fmt=jpeg,既能烟火谋生，又能诗意谋爱人生如旷野，一个人行走难免孤单彷徨。倘若有了朋友的陪伴，心中便会少一分不安，多一分踏实；少一分迷茫，多一分坚定。但也总有人感叹，遇到一个好朋友真的好难。其实，很多值得我们交往的人，就藏在我们身边，只是我们不太注意而已。余生，请珍惜朋友圈里这3种人。01 爱做饭的人一盏精美的碟子，一双玲珑的筷子，摆上色香味俱全的食物，再配上一句暖心小文案，这便是朋友圈里“小吃货”的日常。晒的是美食，背后却是对自己和家人无数细腻的小心思。 “没有小确幸的人生，不过是干巴巴的沙漠罢了。”人们总喜欢追求大幸运的狂喜，往往忽视了那些让自己温暖的小瞬间。而这些爱做饭的人，他们总能在每一个寻常的日子里，系上干净的围裙，认真淘洗每一种蔬菜，切碎，起锅，耐着性子慢慢地烹调。于他们而言，做饭是一件很重要的事，也是一段值得享受的时光。人生真正的幸福，莫过于灯火阑珊的温暖，和柴米油盐的充实。爱做饭的人，仔细，耐心，不计较生活的琐碎，能在普通的日子里种出美丽的花朵。他们的存在，总能让疲于工作的我们，找回生活的初心，去纯粹地享受生命该有的真实。02 爱读书的人一个人但凡有了读书的爱好，也就有了看世界的一种特别眼光。你的生活里，一定有很多感性的朋友，他们可以陪你哭笑打闹，但也少不了几个能理性看待问题，为你指点迷津的军师。爱读书会读书的人，有一种神奇的魔力，他们的三言两语就可能让你有所启发，让你处理不好的关系，瞬间有了最佳答案。每当看到他们朋友圈更新的一些感悟，都会感受到他们身上潜在的智慧，一字一句都在无形中影响着你的认知，帮助你稳定情绪。他们像一面镜子，能照见你从未设想过的样子，让你在困苦中，修了心，也修了容颜。03 爱运动的人运动最大的意义，就是把生活推向正向循环的轨道。可现实是，人都有惰性，明明知道对身体好，要么动不起来，要么三天打鱼两天晒网。而当你在刷朋友圈时，看到爱运动的那些人尽情释放着多巴胺，他们或是迎着朝阳慢跑，或是在球馆挥汗如雨，他们影响着你，爱生活要先爱自己。有这样的人伴你左右，总是时不时会提醒你，快动起来吧，只有健康的人才能率先享受人生。以后的日子，愿你多看看这3种人的朋友圈，既能烟火谋生，又能诗意谋爱，面对生活，有静气，有灵气，有元气。亲爱的你晚安右下角点个赞再走来源：夜听主播：李金迪点赞，祝您晚安！,2025-11-07 21:30:53
西安市委书记方红卫被查！,https://mp.weixin.qq.com/s/935e6uQNnxaGoc8Taygc1w,https://mmbiz.qpic.cn/mmbiz_jpg/azXQmS1HA7k51qib2brfCj5lZDtVWo9oXXXJ8BFU23ibDpJgoQhxK5ibNBeNnonOSvGNhlXGSKsInsHfUFcclXkHg/0?wx_fmt=jpeg,陕西省委常委、西安市委书记方红卫涉嫌严重违纪违法，目前正接受中央纪委国家监委纪律审查和监察调查。来源：中央纪委国家监委网站反腐永远在路上！,2025-11-07 20:06:20
福建舰入列！新华社出图,https://mp.weixin.qq.com/s/L_-jQ5qaQ7LGaZ2FnCk6QQ,https://mmbiz.qpic.cn/mmbiz_jpg/azXQmS1HA7k51qib2brfCj5lZDtVWo9oXhzZKzoa8t8oOxyIqImlqic3wZXUxJT0EvxSJStX5GksXYaW5rM5vK6Q/0?wx_fmt=jpeg,我国第一艘电磁弹射型航空母舰入列11月5日，我国第一艘电磁弹射型航空母舰福建舰入列授旗仪式在海南三亚某军港举行。福建舰是我国第一艘电磁弹射型航空母舰，也是我国第三艘航空母舰，舷号为“18”，2022年6月下水命名。福建舰由我国完全自主设计建造，其电磁弹射技术处于世界先进水平。来源：新华社记者：李刚点赞！,2025-11-07 18:39:31
最低4折！1300余趟列车票价打折优惠,https://mp.weixin.qq.com/s/QNcNkQGKRm9K6ZtsbZnHpw,https://mmbiz.qpic.cn/mmbiz_jpg/azXQmS1HA7k51qib2brfCj5lZDtVWo9oXXXJ8BFU23ibDpJgoQhxK5ibNBeNnonOSvGNhlXGSKsInsHfUFcclXkHg/0?wx_fmt=jpeg,最低4折！铁路部门对1300余趟动车组列车实行淡季票价打折优惠记者11月7日从国铁集团客运中心和相关铁路局集团公司获悉，铁路部门结合淡季客流特点，优化调整部分动车组列车票价，近期对130余条线路的1300余趟动车组列车票价加大打折优惠力度，最低实行4折优惠。国铁集团客运中心相关负责人介绍，近年来，铁路部门依据国家有关规定，持续深化灵活折扣、有升有降的市场化票价机制，相关铁路运输企业陆续将多条线路的动车组列车固定、单一票价机制调整为灵活折扣、有升有降的市场化票价机制。调整后，相关动车组列车的执行票价以铁路12306显示的公布票价为上限，综合考虑区域、淡旺季、时段等因素，实行不同幅度的折扣，对一些旅时较长、客座率偏低的列车执行票价进行较大幅度打折，对一些旅速较快、长期供不应求的列车执行票价进行较小幅度打折或不打折，推动形成不同旅速、不同价格、不同运行时刻的差异化客运产品体系，充分体现优质优价、公平合理的原则，努力为旅客提供更加丰富多样的出行选择。近期，国铁哈尔滨局、北京局、太原局、成都局集团公司等相关铁路运输企业在深入分析当前客流规律和市场需求的基础上，优化调整动车组列车票价，对沈佳、京哈、渝厦等130余条高铁线路的1300余趟动车组列车票价进行打折优惠让利。其中，学生、儿童、残疾军人、伤残人民警察、残疾消防救援人员等特殊群体旅客继续享受“折上折”，最低4折优惠。此外，铁路部门对部分旅时较短、时刻较好、供不应求的动车组列车的执行票价进行较小幅度打折或不打折。以二等座为例，如北京南至上海虹桥的G111次实行周一9.5折、周二至周日9.1折执行票价，北京南至杭州东的G39次实行周五周日不打折、周一至周四和周六9.3折执行票价。来源：新华社记者：樊曦转发周知！,2025-11-07 17:28:45
中国驻日使馆提醒：防范野生动物袭击,https://mp.weixin.qq.com/s/Z8dpcZuYbMNdHFVKZKCpgA,https://mmbiz.qpic.cn/mmbiz_jpg/azXQmS1HA7mfjlaVcm7KbYKuwHVaibTibic482pNNiaP2bdZdxKRcJkgnmUbia9eB7MvhZLgNnxg5IzICVEey37p4yA/0?wx_fmt=jpeg,中国驻日使馆提醒旅日中国公民注意防范野生动物袭击鉴于近期日本多地相继发生熊伤人事件，中国驻日本大使馆6日发布安全提醒，呼吁旅日中国公民提高警惕，确保人身安全。据日本媒体报道，今年4月至9月，日本各地共报告熊出没事件超过2万起，为过去5年最多。遭熊袭击致死者已达10余人，受伤者超过100人，亦创历史新高。日本政府相关部门指出，与往年相比，今年7月以来熊袭击事件更多发生在人类生活圈内，超过七成出现在市街地或居民区附近。此外，东京都、千叶县等地的城镇地区也相继发现野猪出没。中国驻日本大使馆提醒旅日中国公民：出行前应通过地方政府官网、社交媒体或游客中心网站查询野生动物出没信息，避免前往相关区域；避免独自野外登山、徒步，远离林区、山地等人员活动稀少地区，尽量结伴或乘坐车辆出行，并随身携带防熊喷雾、驱熊铃等防护用品；如发现熊活动痕迹应立即折返，如意外遭遇熊，应保持冷静、正面缓慢后退，避免尖叫或奔跑；如遇紧急情况，需及时报警，并联系中国驻日本使领馆或外交部全球领事保护与服务应急热线寻求帮助。来源：新华社记者：李子越、陈泽安转发周知！,2025-11-07 16:03:49
中方驳斥美国代表对中国的无端指责,https://mp.weixin.qq.com/s/4KD9pQSJ774BidsuW2b72w,https://mmbiz.qpic.cn/mmbiz_jpg/azXQmS1HA7k51qib2brfCj5lZDtVWo9oX3hCxl73u3dx5aNApS6YkY4XGXG7Z6c2HN5AzsleBicCnQnSeoTtRdHw/0?wx_fmt=jpeg,中方驳斥美国代表在气候问题上对中国的无端指责中国常驻联合国副代表耿爽6日在安理会气候与安全问题公开会上驳斥美国代表对中国的无端指责。在当天的安理会会议上，美国代表两次发言，指责中国碳排放量巨大，诬称中国“通过不正当手段获得经济优势并污染环境”，同时鼓吹美国环境政策“成功”、是各国“楷模”。耿爽两度回应，驳斥美国代表对中国的无端指责。他表示，中国是全球公认的履行减排承诺意志最坚定、行动最有力、效果最显著的国家，是全球应对气候变化绝对的行动派。中国有14亿人口，国内生产总值居全球第二，多年来对世界经济增长贡献率年均超过30%，中国人均碳排放量在世界上并不处于高水平。耿爽指出，反观美国，它是全球历史累计温室气体排放最多的国家，人均碳排放量一直处于世界的最高水平。同时，美国公然称气候变化是人类历史上最大的骗局，大开历史倒车，两度退出《巴黎协定》，严重破坏全球气候治理的努力，已经成为全球应对气候变化合作最大的障碍。“围绕气候变化问题，谁在采取行动、谁在推卸责任，谁在寻求合作、谁在无理搅局，我想大家看得清清楚楚。”耿爽指出，在应对气候变化问题上，国际社会需要的是团结合作，而不是指责和推责。来源：新华社记者：尚绪谦关注！,2025-11-07 14:31:11
我国第一艘电磁弹射型航空母舰入列  习近平出席入列授旗仪式并登舰视察,https://mp.weixin.qq.com/s/Kody6UQJ6pGNB9j5I4YFVA,https://mmbiz.qpic.cn/mmbiz_jpg/azXQmS1HA7mQvjibkphticwxmeakUKO2ZBg2QfbwWKs1bydhqibS6Via0omJ5tS27xlSDHORVYZnOicONyqqnxPQO3g/0?wx_fmt=jpeg,我国第一艘电磁弹射型航空母舰福建舰入列授旗仪式5日在海南三亚某军港举行。中共中央总书记、国家主席、中央军委主席习近平出席入列授旗仪式并登舰视察。十一月的三亚，海阔天高，碧波浩瀚。军港内，福建舰踏海而立、满旗高悬，山东舰伏波相伴，来自海军部队和航母建设单位的代表2000余人在码头整齐列队，气氛隆重热烈。下午4时30分许，入列授旗仪式开始，全场高唱中华人民共和国国歌，五星红旗冉冉升起。仪仗礼兵护卫着八一军旗，正步行进到主席台前。习近平将八一军旗授予福建舰舰长、政治委员。福建舰舰长、政治委员向习近平敬礼，从习近平手中接过八一军旗。习近平同他们合影留念。入列授旗仪式在中国人民解放军军歌声中结束。习近平对我国航母建设发展一直很关注。仪式结束后，习近平登上福建舰，听取我国航母建设发展工作汇报，了解航母体系作战能力生成、电磁弹射系统建设运用等情况。宽阔的飞行甲板上，4道阻拦索、3个弹射起飞位格外醒目，歼-35、歼-15T、空警-600等新型舰载机依次停放。习近平听取甲板功能布局介绍，不时驻足察看装备设施。习近平同舰载机飞行员亲切交流，详细询问飞机技战术性能和电磁弹射特点优势，观看舰载机弹射放飞流程演示。身着多种颜色马甲的航空保障人员看到习主席到来，纷纷围拢过来，向习主席问好，报告各自岗位和主要职责。习近平勉励大家不断提升专业技能和打仗本领，为福建舰战斗力建设贡献力量。随后，习近平前往福建舰舰岛，登上塔台，了解飞行指挥和起降运行情况。习近平进入驾驶室，察看值勤战位，在航泊日志上郑重签名。习近平亲自决策福建舰采用电磁弹射技术。他来到弹射综合控制站，仔细观摩工作流程，按下弹射按钮，甲板上空载的动子如离弦之箭弹向舰艏。习近平十分关心舰上官兵生活，专门来到餐厅和士兵舱，察看饮食和住宿保障情况，同士兵们亲切交流，叮嘱各级搞好各方面保障，让广大官兵更好投身部队建设和备战打仗。离别时，全舰官兵依依不舍，在飞行甲板和码头整齐列队，向习主席敬礼，齐声高呼“听党指挥、能打胜仗、作风优良”。蔡奇、张国清出席福建舰入列授旗仪式。张升民主持仪式。福建舰是我国第一艘电磁弹射型航空母舰，也是我国第三艘航空母舰，舷号为“18”，2022年6月下水命名。福建舰由我国完全自主设计建造，其电磁弹射技术处于世界先进水平。中央和国家机关有关部门、军委机关有关部门、南部战区、海军、海南省以及航母建设单位的负责同志参加仪式。（新华社三亚11月7日电）来源：新华社记者：梅常伟点赞！,2025-11-07 13:05:22
街头遭醉汉“咸猪手”  墨西哥女总统强硬发声,https://mp.weixin.qq.com/s/nCpTCmURdZsiwJA3FcWbpg,https://mmbiz.qpic.cn/mmbiz_jpg/azXQmS1HA7k51qib2brfCj5lZDtVWo9oXrLOO94IKzZGFxJS2icLJZYngYQ5glicpERLvxJbxy6vN4YLES5n8sRHg/0?wx_fmt=jpeg,墨西哥总统辛鲍姆5日证实，自己前一天在首都墨西哥城街头遭一名醉汉猥亵，并已对该男子提出指控。她呼吁各州审查相关法律和程序，方便女性举报此类行为。据路透社报道，辛鲍姆4日从墨西哥城国家宫步行前往附近的教育部，途中与民众打招呼。视频显示，一名中年男子将辛鲍姆搂住并上下其手，还试图亲吻她。辛鲍姆推开男子的手后，一名工作人员将两人隔开。该男子已于当晚被捕。“如果连总统都会遭遇这种事，那我们国家的年轻女性又会面临什么。”辛鲍姆5日在例行记者会上说，她决定对这名男子提出指控。辛鲍姆说，她12岁乘公交车上学时就曾有过类似被骚扰的经历。她认为此类行为“应当被认定为刑事犯罪”，要求审查各州相关法律。　来源：新华社记者：陈丹、李佳旭视频：李佳旭关注！,2025-11-07 11:02:24
17个女孩的3分半钟，令人泪目！,https://mp.weixin.qq.com/s/Z3g9RXHcZHol8xvI-lmltw,https://mmbiz.qpic.cn/mmbiz_jpg/azXQmS1HA7mfjlaVcm7KbYKuwHVaibTibicnrllvzvmafKkSEFRSn1Kty9MSApoRoWsLsZVsLxDfu5LEjglbCpTcA/0?wx_fmt=jpeg,特写：17个女孩的3分半钟灯光渐起，17个女孩站在舞台中央。舞台两侧，打下两束追光灯，两名指挥老师各站一角，背向观众，随着音乐节拍，对女孩们比划着手势。女孩们听不见声音，却翩然起舞。11月4日下午，全国优秀群众文艺作品展演暨第二十届群星奖颁奖活动在重庆举行。山西太原市聋人学校的17个女孩，现场表演了舞蹈《蒸蒸喜乐》片段。这个节目，也让她们摘得了我国群众文艺领域政府最高奖——群星奖。3分半钟的表演，她们围着一只巨大的“蒸笼”，如浪花一般起落、跳跃、舒展，用灵动的舞步演绎农家民俗场景。山西太原市聋人学校的17个女孩正在表演舞蹈《蒸蒸喜乐》片段。（主办方供图）演出结束，掌声雷动。女孩们听不见，却能感受到现场的这份热烈。下场时，她们不停地与台下观众挥手致谢，脸上是藏不住的喜悦。来到台下，女孩们争相抱着奖杯合影，不时双手翻飞，用手语向同伴表达内心的激动。太原市聋人学校教师、团队领舞魏玉洁，最清楚这一路有多不容易——孩子们最小的五年级，最大的高二，是从全校300多名学生中挑选出来的，没有一个学过专业舞蹈。山西太原市聋人学校的17个女孩正在表演舞蹈《蒸蒸喜乐》片段。（主办方供图）谈起训练的艰苦过程，高一学生师敬桠的脸上掠过一丝复杂的情绪，她用手语对记者“说”：“困难很多，我也数不清。”听不见音乐，很难跟上节奏；缺乏舞蹈基础，连模仿一个动作都很吃力；视觉存在盲区，有时一个转身，就错过了台下指挥老师的手势……从校园排练室走向全国舞台，为这3分半钟的“绽放”，她们花了一年多时间。化妆室里，魏玉洁轻轻挽起一个女孩的裤腿。尚未完全消退的瘀青和疤痕，诉说着坚持的不易。“暑假30多度的天气，我们从清晨练到深夜，一天在排练室待八九个小时。有学生在打磨动作时受伤，却不愿掉队，一直咬牙坚持。”魏玉洁的言语里满是心疼。山西太原市聋人学校师生在参加舞蹈排练。（受访者供图）采访过程中，几个女孩通过打字与记者交流。她们打下几个字，停顿、删掉；凝神思考，再打下几个字——“我们一路上走走停停，确实遇到了很多困难，但是不知道哪来的一份勇气和力量去坚持下来”。这是一股怎样的力量？一说起跳舞就眼睛发亮的学生刘雨馨，在被问及“舞蹈带给你最大的感受是什么”时，忽然低下头沉默，眼眶一点点泛红。我们静静等待着。终于，她抬起头，喉咙微微振动，发出了两个模糊、沙哑，却掷地有声的字音：“自——信——”话音未落，泪水已夺眶而出。这两个字，承载了太多无声世界里的挣扎、否定与最终的自我战胜。她们的世界虽是安静的，但她们的内心，却奔涌着比任何声音都更响亮的渴望——被看见，被“听见”，至少在这3分半钟。“心想事成，我们很开心。”刘雨馨擦着眼泪，笑了。来源：新华社记者：周思宇、吴梦桐、周文冲加油！,2025-11-07 09:25:40
超燃！狮跃东方，全运开场！,https://mp.weixin.qq.com/s/4o1k8NXUXaWtLjSUkqte_w,https://mmbiz.qpic.cn/mmbiz_jpg/azXQmS1HA7k51qib2brfCj5lZDtVWo9oX55dss6zDcTNhyU1C1ocbxwA57bE6JYRojatLHbRjSIBdQDickxuOfzA/0?wx_fmt=jpeg,115年前旧中国举办第一届全国性运动会赛场的呐喊没能唤醒沉睡的东方“雄狮”66年前新中国举办第一届全国运动会投射出初生共和国的青春光影42年前全运会全面接轨奥运开启了中国健儿在世界舞台的传奇8年前“全民全运”的口号响彻神州业余运动员终于可以与专业选手同台比拼全运会66年历程见证了中国前行的铿锵步伐今天东方“雄狮”已经苏醒第十五届全运会圣火即将在大湾区点燃且看中华民族同气连枝聚无不胜！来源：新华社点赞！,2025-11-07 08:25:26
这个成绩，今天可以查了！,https://mp.weixin.qq.com/s/cPK6X3EXy8D1UlMegkpsSg,https://mmbiz.qpic.cn/mmbiz_jpg/azXQmS1HA7kpUXibkGGSXoo8ekjOtFWjBjTeRMicsAu853a6mGO8jmicTqKN935D1WibianpY1eZLWJicmSAufzjSatg/0?wx_fmt=jpeg,2025年下半年中小学教师资格考试（笔试）成绩将于今天（11月7日）上午10点公布！参加此次笔试的考生快来查成绩！点击下方卡片即可一键查成绩本服务由教育部教育考试院提供查询方式进入国务院客户端小程序中小学教师资格考试成绩查询页面输入【姓名】和【证件号码】即可查笔试成绩 提前收藏它助你查分快人一步！记得准时来查成绩祝愿各位考生顺利通过！来源：国务院客户端转发，逢考必过！,2025-11-07 07:45:07
今日立冬！昼短情长，愿你安康,https://mp.weixin.qq.com/s/ddOQ66CfUKB6b2S6zPgNAg,https://mmbiz.qpic.cn/mmbiz_jpg/azXQmS1HA7nM44fticgB9DHkbgkrEic8LSDRdLuGRydaHmQjLI1uHlyqd25dN0ppJIwVNcSBqY7CwkdXmGdhUzag/0?wx_fmt=jpeg,,2025-11-07 06:30:00
早知天下事,https://mp.weixin.qq.com/s/F94_1dECxOcOgpkWH4ul1A,https://mmbiz.qpic.cn/mmbiz_jpg/azXQmS1HA7mfjlaVcm7KbYKuwHVaibTibicNVT3VhIDoZ8RSyTMUYdNBIQMWVzXkpYSqz5FaypbW5fIhXKy2IetGA/0?wx_fmt=jpeg,习近平在听取海南自由贸易港建设工作汇报时强调，认真学习贯彻党的二十届四中全会精神，高标准建设海南自由贸易港。习近平致电祝贺哈桑就任坦桑尼亚总统。习近平同萨摩亚国家元首图伊马莱阿利法诺就中萨建交50周年互致贺电。外交部发言人宣布：应国家主席习近平邀请，泰国国王哇集拉隆功将于11月13日至17日对中国进行国事访问。为强化河湖管理保护、保障国家水安全，水利部近日批准发布《河湖管理范围划定技术规范》，规范将于2026年1月28日起实施。商务部新闻发言人表示，中方愿与各方加强沟通合作，将不断优化许可流程，积极适用通用许可等便利化措施，促进出口管制物项合规贸易。市场监管总局发布数据显示，截至2025年9月，我国各类组织机构总量已达2.02亿家。美国总统特朗普再次对南非进行攻击，称南非不应在二十国集团中，并重申他不会出席本月晚些时候二十国集团领导人约翰内斯堡峰会。普京称俄将采取对等措施回应美国核试验。受台风“海鸥”影响，菲律宾总统马科斯6日宣布全国进入灾难状态。哈立德·埃纳尼正式当选联合国教科文组织总干事。英国媒体6日报道，英国智库“为了英国更美好”中心定于当天发布报告，认为英国正滑向债务危机。重庆市人民政府举行新闻发布会，宣布调整部分行政区划，撤销江北区、渝北区，设立两江新区，科学划分北碚区与两江新区行政区域。我国北部湾海域最大油气平台完成浮托安装。第十二届中国－中亚合作论坛在乌鲁木齐开幕。京唐城际铁路北京城市副中心段进入运行试验阶段。近日，在湖北十堰，一个女孩只有46元，想买鞋给妈妈当生日礼物。老板当即包好鞋子说：“只收你46元 ！” 11月6日20时至7日20时，新疆北疆北部和东部、青海东部和南部、甘肃河西、内蒙古中西部、河北北部、黑龙江东部等地部分地区有小到中雪或雨夹雪，其中，新疆东部、青海东部等地局地有大到暴雪。内蒙古西部、西北地区东部、华北大部、黄淮大部、江淮、江汉、江南北部和东部、西南地区东部、云南西南部、华南大部、台湾岛等地部分地区有小到中雨，其中，安徽中南部、广东西南部沿海、海南岛东部等地局地有大雨。“最好的医生”其实就在你身边，医生眼里的“最好”：白开水、阳光、徒步……如果你经常久坐不动“腰肌劳损”，那睡前就练练这几个动作，练完整个人都舒服多了！【新的一天，加油！】永远不要低估长期主义的价值，很多事情到最后，结果自然水到渠成，甚至可能还会更好。点赞祝早安！,2025-11-07 05:30:00
