标题,链接,封面,内容,推出日期
“定金”和“订金”，有啥不一样？,https://mp.weixin.qq.com/s/fY4qXLg7gbd6PfFRjyYZZA,https://mmbiz.qpic.cn/mmbiz_jpg/azXQmS1HA7nM44fticgB9DHkbgkrEic8LSkXsFnJL1eTeMjF5Q8CugSFWhHLXAK5VHic3ukSZThPf236brbF3vLLw/0?wx_fmt=jpeg,正值“双11”电商购物节，有些消费者在付尾款后想退货，商家却以“定金不退”拒绝退款，理由是“订金”可退，“定金”不退。“订金”与“定金”仅一字之差，生活中很多人也经常混用，但实际上，两者含义和法律效果截然不同。1“定金不退”的法律依据是什么？中国法学会消费者权益保护法研究会副秘书长陈音江介绍，根据民法典第587条规定：给付定金的一方不履行债务或者履行债务不符合约定，致使不能实现合同目的的，无权请求返还定金。陈音江解释：“定金”是法律用语，是合同双方自愿约定的一种债权担保。如果交钱的一方因为个人原因导致合同不能履行，没有权利要求退还“定金”。“订金”是大家习惯的说法，相当于提前给一部分预付款，如果合同不能成交，双方都可以要求退还。2遇到网购纠纷，消费者该如何有效维权？专家介绍，做好证据留存是关键。陈音江提醒，消费者下单时需保存商品宣传页面截图、付款凭证、与商家的沟通记录、商品实物照片或视频等四类证据。专家还提示，消费者在购物平台选择商家时，可查看其首页显示的“证照信息”，尽量选择公示了营业执照、经营地址、联系电话的“正规商家”消费，从源头降低维权风险。来源：央视新闻（记者：王晨、李峻、黄璐、陶泽文、李一凡、苏泽丰）转发周知，一起学习！,2025-11-05 20:28:57
涉及吴石、朱枫、陈宝仓、聂曦……一批重要档案解密！,https://mp.weixin.qq.com/s/gMkZ_Qb2BndC86n3FzXxjQ,https://mmbiz.qpic.cn/mmbiz_jpg/azXQmS1HA7nM44fticgB9DHkbgkrEic8LSJ8gM8Q2GHXBAibcz5bX0cyKeSsgSgcCRNuiaS05LkH9qG79aHMju9ZMg/0?wx_fmt=jpeg,吴石、朱枫、陈宝仓、聂曦……他们是隐蔽战线上的英雄也是热播电视剧《沉默的荣耀》中的原型人物近日，国家安全部解密了一批重要档案就与他们有关这批重要档案中有组织下达给吴石的搜情指令有朱枫深入虎穴传递回的重要情报有翻破了的密码本残页有我党生死绝境的营救计划还有幸福美满的全家福也有饱含深情的家书和对党绝对忠诚坚定赴死的诀别书吴石推开高官厚禄朱枫放下优渥生活陈宝仓舍弃阖家团圆聂曦离别年迈父母报以“我之牺牲换国之新生”的信念隐于暗处，精准传递情报用智慧免去更多的牺牲不惜一切代价化作暗夜中前行的光牺牲小家换万家安宁视频中披露，英雄遇难后党组织第一时间启动营救计划然而国际局势动荡叛徒破坏严重营救行动遇到重重阻碍为优先确保未暴露同志的安全转移对烈士家属的接应照顾只能暂缓并秘密推进家属们亦是无名战士他们继承先烈遗志用隐忍与坚守为英雄的信仰选择筑起了最坚实的后方将小家庭的牵挂与期盼深深种进祖国和平统一的土壤里山河不会忘记人民不会忘记从1952年发放烈士证到2013年北京西山无名英雄纪念碑的落成再到烈士安葬、故居修缮每一次铭记都是对英雄最好的告慰更是对正义必胜祖国统一信念的坚定传承来源：央视新闻微信公众号综合国家安全部致敬忠魂！,2025-11-05 18:56:52
国足新任主教练，是他！,https://mp.weixin.qq.com/s/DnBAmwzFf8lSxyINYnTNUw,https://mmbiz.qpic.cn/mmbiz_jpg/azXQmS1HA7lcmHLBTbuONmdcDZ0uhEtQtf1HuuGxhtVq6Ab5SY9icGsial7Mfbc1ZRF6ZZwzRJebte7icXVXQJZhA/0?wx_fmt=jpeg,邵佳一出任中国国家男子足球队主教练经过公开选聘，中国足球协会研究决定聘任邵佳一为中国国家男子足球队主教练。中国足协于2025年9月5日发布中国国家男子足球队主教练公开选聘公告，有多名符合报名条件和要求的中方、外籍教练候选人进入初选环节。随后，由中外资深足球专家组成的选聘专家组严格按照选聘标准和程序对候选人进行了初选、线上面试，就候选人执教履历、比赛理念、训练比赛指导和管理方法、沟通交流能力、岗位适配性等方面展开充分评议，并提出推荐人选。中国足球协会综合考虑以往国家队主教练选聘经验和教训、中国男子足球现状与水平、国家队长远建设与发展、教练员素质与执教能力、专家组意见等因素，经慎重研究，决定聘任邵佳一为中国国家男子足球队主教练。中国足协衷心感谢社会各界对中国足球和男足国家队主教练选聘工作的支持！中国足协网站截图来源：中国足协网站关注！,2025-11-05 17:44:51
巴西，临时迁都,https://mp.weixin.qq.com/s/Vrp8CRncsUwup1s7ezkD8g,https://mmbiz.qpic.cn/mmbiz_jpg/azXQmS1HA7lcmHLBTbuONmdcDZ0uhEtQtf1HuuGxhtVq6Ab5SY9icGsial7Mfbc1ZRF6ZZwzRJebte7icXVXQJZhA/0?wx_fmt=jpeg,巴西将在联合国气变大会期间临时迁都巴西总统卢拉4日在巴西北部帕拉州首府贝伦签署法案，决定在11月11日至21日期间将巴西首都由巴西利亚迁至贝伦，以配合即将在贝伦举行的《联合国气候变化框架公约》第三十次缔约方大会（COP30）。巴西政府4日发布公告说，贝伦作为临时首都期间，行政、立法和司法三大权力部门均可在此办公，总统及部长签发的所有文件和指令均将签发地改为贝伦。贝伦是亚马孙雨林地区重要的交通与经济枢纽。公告说，巴西希望通过临时迁都凸显亚马孙地区在全球环境议程中的重要性，强调巴西应对气候变化的承诺。本次联合国气候变化大会将于本月10日至21日举行。此前，巴西曾于1992年联合国环境与发展大会期间将首都临时迁至里约热内卢。来源：新华社记者：吴昊关注！,2025-11-05 16:31:54
爸爸送女儿进派出所：她卡里还有80多万元……,https://mp.weixin.qq.com/s/RJiYg3_WSeng3ty_eC15BA,https://mmbiz.qpic.cn/mmbiz_jpg/azXQmS1HA7nM44fticgB9DHkbgkrEic8LSA3icibZ5qiaVPfoof2O8r3pmQvLAR4kUSMlQic5a5HSacQXeIpRS3BCurg/0?wx_fmt=jpeg,一通电话后父亲把女儿送去了派出所反而被网友点赞！咋回事？10月30日14时许浙江杭州上城公安接到反诈预警市民黄女士（化名）正在向涉诈账户转账望江派出所反诈专员陆雅萍立即拨通了黄女士的电话然而，黄女士对转账原因含糊其辞以“开店”“转钱”等理由搪塞拒绝透露具体情况和所在位置接听电话时，黄女士的父亲就在她身边他从女儿支支吾吾的回应和反诈专员的问话中敏锐地察觉到情况不对“她没有工作，哪来的店？”父亲果断拿过电话与反诈专员沟通起来在了解情况后，他当即表示“我马上带她来派出所！”来到派出所陆雅萍在征得黄女士的同意后协助她查看了账户情况经核实银行卡内81万余元尚未被转出父亲并未责备女儿而是进行了耐心的劝导“我们现在过来，就是要把事情搞清楚警察是在帮我们，你要相信他们”正是父亲这番通情达理的劝说消除了黄女士的顾虑她详细讲述了陷入骗局的经过原来黄女士因骨折在家休养想找兼职补贴家用前段时间她在网上投递了自己的简历很快有公司通过企业微信添加了她的好友并主动出示了“营业执照和公司文件”对方以“软件推广”名义派发任务承诺每单可以给她返利几十元让黄女士下载了刷单软件（诈骗软件）最初完成几笔任务后黄女士确实收到了10元、20元的小额返款随后，她被诱导进行大额充值对方将她与另外3名“用户”拉成群并称其他人都操作成功并获得了返利唯独黄女士因“操作失误”而没有返款对方以“修复账户”“补单”为由要求她转账企图让她投入更多资金“这不就是刷单吗？刷单是违法的！”陆雅萍一针见血地指出骗局本质“前面给你转几块几十块就是为了诱你深入这都是设计好的诱饵！”“但他们有营业执照……”黄女士说道陆雅萍解释道“骗子一开始就出示假文件正是为了包装自己、让你放松警惕这些都可以伪造的”经过层层剖析黄女士才幡然醒悟陆雅萍从2024年6月开始从事反诈工作虽然时间不长但已成功劝阻多起诈骗案件她表示“能为大家守好血汗钱看到他们安心的样子我觉得一切付出都值得”警方提醒任何形式的“刷单返利”均为诈骗切勿轻信“轻松赚钱”的诱惑遇到类似情况要保持警惕及时拨打110或96110咨询举报来源：新华网微信公众号综合浙江公安转发提醒！,2025-11-05 15:18:32
为什么医生劝你冬天穿袜子睡觉？好处让人意想不到,https://mp.weixin.qq.com/s/vgfTvQbTuwjsbV7vOiqqng,https://mmbiz.qpic.cn/mmbiz_jpg/azXQmS1HA7nM44fticgB9DHkbgkrEic8LSkXsFnJL1eTeMjF5Q8CugSFWhHLXAK5VHic3ukSZThPf236brbF3vLLw/0?wx_fmt=jpeg,最近天气冷，不少人手脚就像“冰块”一样，尤其是晚上钻进被窝——双脚冰凉。那个纠结多年的问题又来了：睡觉到底要不要穿袜子？有的人感觉穿着袜子睡觉睡眠更好了，但也有人觉得穿着袜子睡不着；不过先别急着站队！有个让人意想不到的结论：穿袜子睡觉不仅能暖脚，更能帮你睡得更好！为啥劝你穿袜睡觉？调节身体温度，提升睡眠质量河南省郑州市中心医院神经内科副主任医师窦海玲介绍：睡觉时穿双袜子可以大大改善睡眠质量，主要和身体这2个部位的温度有关。（1）身体的核心温度：人体的核心（心脏、主躯干等）温度，通常比较稳定；（2）身体的肢体温度：远离核心区域的皮肤温度，包括手、小腿和脚等部位的温度，通常易受外界环境影响。进入睡眠时，核心温度会下降，远端温度会升高。研究发现，较低的核心体温和较高的远端皮肤温度，有利于快速入睡。当双脚冰冷时，不能很好地进行散热，核心温度因此受到影响。一旦体温节律紊乱，人就可能睡不好。随着年龄增长，人体调节体温的能力可能会下降，穿袜子可以帮助保持舒适和温暖的睡眠环境。所以，穿袜子相当于给身体一个温柔的指令：“环境温暖，可以安心睡觉了。”穿袜子睡觉，身体悄悄发生5个改变1. 促进血液循环浙江省中医院中医内科主任夏永良介绍，穿袜子会直接保暖脚部，通过促进脚部血液循环，可使血液更顺畅地回流心脏，进而改善血液循环。对于体质虚寒、末梢循环差的人，能减少热量散失，使全身感觉温暖。尤其在寒冷环境中，穿袜子可有效防止脚部受凉，避免因脚冷导致的身体热量消耗增加。2. 减轻身体负担四川省成都市第三人民医院中医科主治医师康丽指出，穿袜子睡觉可以减少身体能量消耗，让身体更好地休息。3. 避免诱发疾病康丽医生表示，保持脚部温暖有助于减少感冒和其他疾病的发生。尤其像慢阻肺、痰湿体质的患者，如果能保护好足底，防止寒从脚起，既可以促进循环通过温通经络，减少痰湿的生成，同时可以有效防止体内宿痰因寒邪诱发加重症状。4. 减少关节疼痛湖北省武汉市东湖医院中医科主任医师陈红表示，穿袜子可以阻止寒气从脚部进入身体，进而减少关节疼痛，特别是患有关节炎的人群，穿袜子睡觉有助于缓解疼痛。5. 预防皮肤干裂江苏省南京市第二医院中医科主任中医师沈建军指出，秋冬容易皮肤开裂和水分缺乏、天气干燥有关，清洁双脚后及时涂抹保湿霜，套上袜子，可以减少水分流失，防止热量散发过快，减少足部与床单被套之间的摩擦，防止开裂部位出血。人民日报健康客户端图注意！4类人最好不要穿袜子睡觉尽管穿袜子好处多，但不是人人都适合，以下4类人群请谨慎：1. 下肢水肿的人：下肢水肿的患者，袜子的压力可能进一步阻碍血液循环，加重水肿。2. 糖尿病的患者：糖尿病患者可能存在神经感知不敏感的问题，袜子过紧可能导致脚部损伤不易察觉。3. 足部皮肤感染者：穿着袜子不利于汗液排出，导致足部过于湿润，为细菌繁殖创造条件，引发或加重感染。4. 手脚发热的人：阴虚的人常有手足心发热症状，这两类人群穿袜子会加重内热症状，导致脚部闷热，影响睡眠质量。穿袜子睡觉，注意4个细节1. 选择宽松的棉袜：优选宽松、柔软、透气性好的棉质袜，避免紧口袜或厚重款式，以减少对脚部血液循环的影响。2. 保持脚部的干爽：睡前务必洗脚并彻底擦干，避免湿脚穿袜，以防因潮湿滋生细菌或引发不适。3. 准备专用睡眠袜：建议准备一双专门用于睡觉的袜子，与日常外穿的袜子分开。4. 睡眠袜勤洗勤换：睡眠袜会接触皮屑与细菌，即使只在睡觉时穿着，也需勤洗勤换，保持清洁。来源：人民日报健康客户端转发给家人朋友！,2025-11-05 14:14:03
新任干部为炫耀公务员身份泄密，被处分！,https://mp.weixin.qq.com/s/WPukeBO3ZS1QivkcXFL5hw,https://mmbiz.qpic.cn/mmbiz_jpg/azXQmS1HA7nM44fticgB9DHkbgkrEic8LSjEYStHTIJAAFWflsNPJkV5j4BuSZCyD5IayTDATsBWCqVmCVbtVPNQ/0?wx_fmt=jpeg,11月5日，“国家安全部”微信公众号发布案例，提醒警惕指尖上的泄密风险：有公开案例显示，某涉密单位办公室主任孙某出于工作便利考虑，违规拍摄机密级文件，并使用图文识别小程序转化为电子文档。殊不知，其使用的小程序将此涉密内容自动存储在第三方服务器。在孙某自认为操作隐秘，“删除本地文件就万事大吉”之时，小程序开发公司的员工竟将涉密文件打包倒卖。案发后，涉事员工被依法追究刑事责任，孙某也因严重违反保密规定受到严厉处分。某市直机关新任干部蒋某参加市委某会议后，为炫耀公务员身份，擅自将会议领取的秘密级文件首页拍照上传至朋友圈。尽管10分钟后在领导责令下紧急删除照片，但好友截图保存及转发已形成传播链，造成泄密。事后蒋某被给予党纪政务处分。在信息技术快速发展的当下，手机已不仅是通讯工具，更是国家安全的前沿阵地。《中华人民共和国保守国家秘密法》规定，禁止未按照国家保密规定和标准采取有效保密措施，在互联网及其他公共信息网络或者有线和无线通信中传递国家秘密。来源：人民网微信公众号综合国家安全部微信公众号引以为戒！,2025-11-05 12:52:44
国台办新任发言人，亮相！,https://mp.weixin.qq.com/s/bkcn9cbw2jyVsTml8fwj6g,https://mmbiz.qpic.cn/mmbiz_jpg/azXQmS1HA7nM44fticgB9DHkbgkrEic8LSB6BNXyiaV1iaBxCNXTmWoma41L6byaYCd99jnvDYBiaRQUmHeysVCXTtg/0?wx_fmt=jpeg,国台办新任发言人张晗亮相国务院台湾事务办公室5日举行例行新闻发布会，新任发言人张晗正式面向媒体亮相。“各位记者朋友，大家上午好，欢迎参加国务院台办新闻发布会。借此机会向各位台湾同胞问好。今天的发布会由我来主持，希望今后同各位记者共同努力，宣介好大陆对台方针政策，增进两岸同胞的了解、理解和信任。”张晗说。来源：新华社记者：尚昊、李寒芳、陈晔华点赞！,2025-11-05 11:33:00
神舟二十号载人飞船返回任务将推迟进行,https://mp.weixin.qq.com/s/vydHLq4SWPc9E5C3mDCHnA,https://mmbiz.qpic.cn/mmbiz_jpg/azXQmS1HA7mQvjibkphticwxmeakUKO2ZBXC3RYibfwIQ5BzmqzgPj63cAPryrDFevSnFYMr2nC1NYR6qJfJcsSQw/0?wx_fmt=jpeg,记者从中国载人航天工程办公室了解到，神舟二十号载人飞船疑似遭空间微小碎片撞击，正在进行影响分析和风险评估。为确保航天员生命健康安全和任务圆满成功，经研究决定，原计划11月5日实施的神舟二十号返回任务将推迟进行。来源：新华社作者：李国利、杨欣,2025-11-05 10:02:09
一些基层乡镇政府为何“门难进”,https://mp.weixin.qq.com/s/i3oaJJ-vjh02PeT_IT96Xw,https://mmbiz.qpic.cn/mmbiz_jpg/azXQmS1HA7nM44fticgB9DHkbgkrEic8LSHZk8YDlB84GGpdibTG2IKPjoQr7OyyRVGiagDXKhAYfdmsTT3LufG7YQ/0?wx_fmt=jpeg,群众路线是党的根本工作路线。半月谈记者在基层走访发现，一些乡镇政府在大门口设置了道闸、岗亭、门卫，群众进出需要联系、登记，手续繁杂，一些群众啧有烦言。与此同时，部分基层政府在“门”开与不开之间左右摇摆：一面是群众抱怨“门难进”，一面是敞开后“怕出事”。如何找到安全与开放、管理与服务之间的平衡点，考验着基层政府的智慧与担当。一些基层乡镇政府“门难进”有群众反映，现在进乡镇政府机关的门，首先要在值班室说明来意、找何人，经当场联系确认并出示身份证、工作证，登记后方可进入；如果找的人不在，则不能进入。这道物理上的关卡，如今正成为横亘在部分基层政府与群众之间的一道“墙”。半月谈记者近期来到东部某市一个镇政府，只见门口设有道闸，张贴的“人员进出须知”上明确写道：机关单位工作人员刷卡进入；外来办事人员凭单位介绍信、居民身份证、工作证等有效证件进行登记，经门卫或接待部门同意后方可进入；未经许可，闲杂人员请勿入内；双休日、节假日和下班后，非机关工作人员一律禁止进入等。半月谈记者向门卫提出要找镇领导，被拒绝入内；再电话联系办公室相关负责人，也被拒绝进入；随后根据门卫要求，半月谈记者来到边上的信访接待中心，向工作人员提出进入镇政府大院，同样被拒绝。半月谈记者在长三角某市一些乡镇暗访也遭遇类似情况。半月谈记者多次询问，群众没有事就不能进镇政府大院？相关乡镇工作人员均予以拒绝。在半月谈记者亮明身份后，上述两市的乡镇均表态立即整改，包括强化门卫接访培训、优化来访分类处理、落实即报即处机制等。安全顾虑与开放呼声如何平衡基层乡镇政府为何不对群众敞开大门？半月谈记者调研了解到，乡镇政府主要有两方面考虑：一方面是担心影响政府机关安全，关门有利于维持办公秩序。“作为政府机关，对安全管理有要求，不能随便进。”一位乡镇负责人说，“乡镇也是国家机关，如果不做一定设置，让不法分子有可乘之机，后果不可估量。”另一方面，一些基层干部认为，乡镇已经设有信访接待中心和便民服务中心，没有必要再开政府大门。多名乡镇工作人员说，群众如果有事，会有专门的工作人员接待，没事不要乱进，“政府大院不是公园，不可以随便逛”。开门办公是否容易失序？半月谈记者采访了解到，一些乡镇政府大院开放后，管理秩序并未出现“不可控制”的情况，反倒是群众“点赞”更多了。半月谈记者在江苏泰兴市宣堡镇、靖江市孤山镇等地看到，群众可以自由进出镇政府，到各个部门也没有受到阻拦，政府办公秩序未受影响。一些乡镇政府对群众开放后，干群关系更加紧密。例如，在农忙时节，一些乡镇政府会主动敞开大院，让农户晒粮。金黄的稻谷铺满洁净的院坝，成为一道独特的风景。这不仅解决了群众需要晒粮场地的燃眉之急，更在日复一日的相处中，让干部与群众的心贴得更近。近年来，全国多地乡镇政府敞开大门，受到群众欢迎。江苏扬州市政府每逢国庆等节假日，都会为游客提供餐饮和免费停车服务。安徽六安市舒城县政府大院随意进出无门禁，自由停车不收费，被群众称为“比自家小区还容易进出的政府大院”。舒城县一名政府工作人员接受媒体采访时说：“政府大院要为群众服务，当然不应该关着门，进来‘看稀奇’的人不多，不会影响政府工作。”不开放乡镇政府大院也不影响群众办事？不少群众认为，乡镇政府大院是为群众服务的地方，没有特殊情况不应该设门槛。即使设有信访接待中心，但有些问题需要主要领导解决，群众进出不方便，反映问题找不到人，一定程度上拉大了基层政府与群众之间的距离。敞开大门践行群众路线有关专家、受访干群认为，做群众工作，最怕干部和群众之间有距离感。乡镇政府是与老百姓接触最多、最直接的部门，没有特殊情况应该向群众敞开大门，成为化解基层矛盾纠纷的前沿阵地。人们在镇政府广场上晾晒粮食 黄伟 摄——拆除干群心理围墙。当乡镇政府打开大门，以更加开放的心态面对群众，群众自然会感受到这份诚意与温暖，党群干群关系必然更加融洽。中央党校（国家行政学院）教授竹立家说：“随便进出，对于群众来说，更多的是心理层面的‘认同感’与‘获得感’，开放的是大院，体现的是为民理念。”——增强基层服务意识。乡镇政府大院开放后，可以满足群众避暑、躲雨等突发或临时性需求。一些乡镇政府大院位置优越、景色宜人，不应成为少数人独享的“深宅大院”，开放后可以为群众提供放松休闲、错峰停车等服务。——更多倾听群众心声。群众到乡镇政府大院，直接向乡镇领导反映意见、提出建议，有助于基层政府更加准确地把握群众需求，让中央政策更好落地，同时能激发群众更加主动积极参与基层治理，实现共建共治共享。江苏一位乡镇书记坦言：“一些群众希望找镇干部帮助解决问题，我们应该敞开大门。”——利于接受群众监督。让群众进出自由，将政府工作置于阳光之下，接受群众的检验和评判，有利于建立透明、廉洁、公正、高效的基层治理体系。一些基层干部表示，相较于信访、举报等正式渠道，“随时可看”的日常监督更高效、更可持续。来源：半月谈记者：沈汝发关注！,2025-11-05 09:43:00
